{
  "runtime": "codex-minimal",
  "mode": "research",
  "profile": "source-collector",
  "capability": "source-acquisition",
  "dispatch_request": {
    "target": "think-tank/examples/browser-automation-fixture.html",
    "constraints": ["readonly", "no_login", "no_download"]
  },
  "dispatch_decision": {
    "selected_skill": "local_static_reader",
    "status": "dispatched",
    "risk_level": "low"
  },
  "invocation": {
    "invoked": true,
    "method": "local_static_reader",
    "target": "think-tank/examples/browser-automation-fixture.html",
    "result_status": "success"
  },
  "recovery": {
    "result_recovered": true,
    "recovered_as": ["sources[]", "evidence[]"]
  },
  "sources": [
    {
      "title": "think-tank browser automation fixture",
      "url": "think-tank/examples/browser-automation-fixture.html",
      "source_type": "static-html",
      "summary": "Local static fixture used to verify the minimal source-acquisition runtime contract.",
      "reliability": "medium",
      "freshness": "2026-05-14T13:03:52+00:00",
      "extracted_at": "2026-05-14T13:03:52+00:00"
    }
  ],
  "evidence": [
    "dispatch_decision was produced before invocation.",
    "local_static_reader returned readable static content."
  ],
  "boundaries": [
    "Only one local static fixture was read.",
    "No fallback, browser DOM, login state, or private write was attempted."
  ],
  "quality_check": {
    "protocol_complete": true,
    "evidence_boundary_clear": true,
    "actionable": true
  }
}
